AWRAXV1RIYR0M, Pl, Sc, Sc, Sc, Sc, Pl, Ex, Ev, De, Ev, Ev, Pl, Ex, Sc, Ex, Sc, Ex/Pe/So, Ex/So, Ex, Ex, St
A2YBGZ2H2KSO5T, Ev, Sc, Sc, Sc, Ev, Ev, Sc, Ex, Ex, Ex/Pe/So, Ex, Ex
A21IFZJ0EDKM4E, Ev, Sc, Sc, Sc, Sc, Sc, Co/Ex, Ev, Co, De, Sc, Ev/Ex, Sc, So/Ex, Ex, So/Pe, Ex, Ex, Pe
A21SF3IKIZB0VN, Ev, Sc, Sc, Co/Pe, Ev/Co, Co/Sc, Co/Sc, Sc/Ex, Ex, Sc/Ex, Pe/So, Ex, Ex, Sc, St, Pe, Ex
AM155T4U3RE1A, Pl, Ev, Sc, Sc, Sc, Ev, Ex, Co, Ev, De, Sc, Ex, Ex, De, De, Sc, Pe/So, Ex, So, Ex, Ex, Pe, Ex, Ex
AO3XB5I5QNNUI, Pl, Sc, Sc, Sc, Sc, Sc, Ex/So, Ex, Ex/Pe, Ex, Ex
APXNY64HXO08K, Pl, Sc, Sc, Sc, Sc, Ex, Ex, Ex/Pe/So, Ex, St
A3RLCGRXA34GC0, Ex/Sc, Sc, Sc, Sc, Sc, Sc, Sc, Sc, Sc, Sc, Sc, Sc, Sc, Ex/Pe, Ex, Ev, Sc, So/Sc, Sc, Pe/So, Ex, Pe/So, Ex, Ex, Ev, Ev, Ex
A23S6QOSZH9TMT, Ex/Pe, Ex/Sc, Sc, Sc, Sc, Sc, Sc, Sc, Sc, Sc, Sc, Ev/So, Sc, Ev, Ev/Sc, Ex, Sc, So/Sc, Co/Sc, Pe/So/Ex, Ex, Ex, Ex, Pe, Ev, Ex, Ev